{
  "$schema": "https://json-schema.org/draft/2020-12/schema",
  "title": "agent-team-kit task profile registry",
  "type": "object",
  "additionalProperties": false,
  "required": ["schema_version", "capabilities", "data_classes", "task_type_defaults", "profiles"],
  "properties": {
    "schema_version": {"const": 1},
    "capabilities": {
      "type": "object",
      "minProperties": 1,
      "additionalProperties": {"type": "string", "minLength": 1}
    },
    "data_classes": {
      "type": "array",
      "minItems": 1,
      "uniqueItems": true,
      "items": {"type": "string", "minLength": 1}
    },
    "task_type_defaults": {
      "type": "object",
      "minProperties": 1,
      "additionalProperties": {"type": ["string", "null"]}
    },
    "profiles": {
      "type": "array",
      "minItems": 1,
      "items": {
        "type": "object",
        "additionalProperties": false,
        "required": [
          "id",
          "title",
          "description",
          "required_capabilities",
          "optional_capabilities",
          "default_data_class",
          "cloud_policy",
          "connector_policy",
          "reasoning_class"
        ],
        "properties": {
          "id": {"type": "string", "pattern": "^[a-z][a-z0-9_]*$"},
          "title": {"type": "string", "minLength": 1},
          "description": {"type": "string", "minLength": 1},
          "required_capabilities": {"type": "array", "uniqueItems": true, "items": {"type": "string"}},
          "optional_capabilities": {"type": "array", "uniqueItems": true, "items": {"type": "string"}},
          "default_data_class": {"type": "string"},
          "cloud_policy": {"enum": ["allow", "conditional", "forbid"]},
          "connector_policy": {"enum": ["allow", "conditional", "forbid"]},
          "reasoning_class": {"enum": ["fast", "balanced", "deep"]}
        }
      }
    }
  }
}
